{
  "schemaId": "cd-collab.gold_reference.v1",
  "goldId": "gold-synth-three-model-checkout-v1",
  "version": 1,
  "predecessorGoldId": null,
  "caseId": "case-synth-checkout-timeouts",
  "experimentId": "exp-synth-three-model-checkout-v1",
  "packageId": "pkg-synth-three-model-checkout-v1",
  "taskFingerprint": "task-162aec8ca84e72ecfc9164d4168d18b6e41367e7c10e9c23aef086bf83bfd007",
  "snapshotFingerprint": "snap-5a75de4d710765b3fbb87afdc85beb25fd96f23b46ef4c59d416aa7ae61bbceb",
  "acceptedDecisionId": "dec-synth-checkout-inventory-timeout",
  "acceptedDecisionRevision": 2,
  "auditRefs": [
    "experiment_decision_accept:dec-synth-checkout-inventory-timeout:2",
    "experiment_gold_promote:gold-synth-three-model-checkout-v1:1"
  ],
  "evidenceAnchors": ["ev-demo-checkout-log", "ev-demo-inventory-timeout"],
  "expectedRelationships": [
    { "evidenceRef": "ev-demo-checkout-log", "role": "symptom" },
    { "evidenceRef": "ev-demo-inventory-timeout", "role": "cause" }
  ],
  "helpfulnessDimensions": ["evidence_support", "actionability"],
  "notes": [
    "A gold reference is a human benchmark decision, not an infallible truth claim.",
    "Synthetic three-model checkout fixture. Not live provider output."
  ],
  "promotedById": "participant",
  "promotedByUsername": "case-lead",
  "createdAt": "2026-08-19T00:00:00Z"
}
